{
  "schema_id": "atlas.lifecycle.event",
  "schema_version": "1.0.0",
  "record_id": "LEV-DTF3UE2XNNKGA4L2FF5TNXZFQD",
  "authority": "NONCANONICAL_FIXTURE",
  "event_class": "TRANSITION",
  "event_type": "GATE_COMPLETED",
  "target": {
    "entity_type": "GATE",
    "entity_id": "found-silverlight.gate-fixture"
  },
  "position": {
    "project_id": "project-codex",
    "operation_id": "operation-source-governance",
    "quest_id": "found-silverlight",
    "campaign_id": "campaign-fixture",
    "mission_id": "mission-fixture",
    "gate_id": "gate-fixture"
  },
  "expectations": {
    "expected_main_sha": "0000000000000000000000000000000000000000",
    "expected_entity_revision": 1,
    "expected_quest_revision": 1,
    "expected_gate_revision": 1,
    "expected_prior_state": "Gate is in progress with one accepted checkpoint.",
    "expected_parent_checkpoint_id": "LEV-CTNL73NPCTPRYXPVBZVZHA4TSD",
    "expected_source_fingerprint": "sha256:7777777777777777777777777777777777777777777777777777777777777777",
    "trusted_expectation_ref": {
      "ref_id": "fixture-event-trust-root",
      "authority": "CANONICAL_SOURCE",
      "uri": "lifecycle/trust-roots/fixture-event-trust-root.json"
    }
  },
  "evidence": {
    "exact_subject_sha": "2222222222222222222222222222222222222222",
    "accepted_evidence_digest": "sha256:2222222222222222222222222222222222222222222222222222222222222222",
    "trusted_acceptance_receipt_ref": {
      "ref_id": "fixture-gate-completion-receipt",
      "authority": "EVIDENCE_POINTER",
      "uri": "proof/fixture-gate-completion-receipt.json"
    },
    "evidence_pointers": [
      {
        "ref_id": "checkpoint-fixture",
        "authority": "EVIDENCE_POINTER",
        "uri": "lifecycle/fixtures/lifecycle-event-checkpoint.json"
      }
    ]
  },
  "protected_data": {
    "classification": "INTERNAL_CLEAN",
    "clean_summary": "Harmless transition fixture contains no protected values.",
    "protected_pointers": []
  },
  "semantic_author": "athena",
  "route": {
    "route_authority": "ATHENA_DIRECT",
    "allowed_paths": ["lifecycle/events/gate-completion-candidate.json"],
    "direct_main": false,
    "automatic_merge": false
  },
  "related_record_ids": ["LEV-CTNL73NPCTPRYXPVBZVZHA4TSD"],
  "lineage": {
    "parent_event_id": "LEV-CTNL73NPCTPRYXPVBZVZHA4TSD",
    "supersedes_event_id": null,
    "invalidates_event_id": null,
    "reverses_event_id": null,
    "revokes_event_id": null,
    "reopens_event_id": null
  },
  "replay_key": "sha256:9999999999999999999999999999999999999999999999999999999999999999",
  "checkpoint": null,
  "transition": {
    "requested_resulting_state": "Gate complete with the predetermined next Gate declared.",
    "declared_next_gate": "gate-fixture-next",
    "acceptance_criteria": [
      "Every declared harmless fixture criterion is satisfied.",
      "Exact accepted evidence matches the independently trusted receipt."
    ],
    "authorized_blocker_ids": [],
    "acceptance_semantically_authored": true,
    "ordinary_merge_event": false,
    "generated_output_trigger": false
  }
}
